店舗名,郵便番号,住所,営業時間,定休日,カード（カード使用ができるかどうか）,電話,URL,緯度,経度,店舗紹介,頭文字
アクトCafe,,静岡県島田市島76-1,7：30～17：30,第１・３土曜/日曜※レンタルは第１・３土曜/日曜ともご利用いただけます。,,0547-45-3101,http://www.act-home.jp/,34.84022,138.133644,アクトCafeでは、毎月、講師の方を招き、心豊かに暮らすヒントを学ぶ講座「くらし・たのしの会」を開催しています。日々の暮らしの中で、アクトCafeで学んだことをふと思い出し、“日常にプラスα”をしてもらえたらとうれしいです。また、会場はレンタルスペースとしてもご利用いただけます。木に包まれ、心地よい空間で、、誰でも利用可能な『レンタルスペース』。 ちょっとした会合や、各種教室、ライブ、イベント会場としてお使い頂けます。 キッチン付きなので、お料理教室や開業前のプレ店舗としての利用も可能です。 利用時間はam8:00~pm9:00。利用料は１時間毎500円（最初の１時間のみ1000円）となっております。,あ
朝日園 茶房遊,428-0103,静岡県島田市川根町身成4693番地,10時～18時,不定休,,0547-53-4488,,34.930125,138.085281,川根町にあるお茶カフェです。家族みんなで楽しめる空間です。川根茶の販売はもちろんのこと、一年中提供しているかき氷は大人気♪その他、川根抹茶のジェラートやソフトクリリームなどがございます。,あ
朝日園 駅前店,428-0104,静岡県島田市川根町家山372-1,8:00～18:00,年中無休,,0547-53-2058,,34.940866,138.077533,大井川鐡道家山駅から徒歩１０秒のお店の前には、ＳＬが走っています。囲炉裏の前でお茶を飲みながら、ＳＬの汽笛が聞こえてきます。店内のどのお茶も試飲が可能となっておりますので、お気軽にご相談ください。（喫茶はございません）,あ
味わい処 座楽,426-0063,静岡県藤枝市青南町4-12-22,11時から22時,水,,054-636-7890,https://r.gnavi.co.jp/5hbknu6z0000/,34.837283,138.235667,藤枝と島田の境にある「味わい処 座楽」。海鮮料理と20種以上の日本酒がウリ 他にはなかなかない「離乳食のメニュー」が充実お子様づれでも、ゆっくりと楽しめるお店です。送迎バスもありますので帰りを気にすることなく楽しめます。個室2～50名様迄OK,あ
磯藤,,島田市大井町2-4,ランチ11:00～14:00（ラストオーダー13:15）夜17:00～22:00,水曜,,0547-35-0225,,34.834798,138.172965,小さくアットホームなお店です。お客様同士が仲良くなれ新しい人の繋がりが持てる事も魅力の１つです。,あ
お食事処たばこや,428-0104,静岡県島田市川根町家山６６０－２,１１：００～１４：００・１７：００～２０：００,月曜日,,0547-53-2103,,34.942367,138.075808,川根のまちで食事処やってます！お昼は定食をメインに食事を提供しております。また法事、慶事等宴会などにもご利用頂けます。,あ
有限会社 お茶のあおしま,427-0104,静岡県島田市井口1206,9:00am-18:00pm,日曜日 祭日（シマアツ開催日は営業）,,0547-38-3739,http://www.ocha-aoshima.co.jp,34.794751,138.233864,静岡県内のお茶農家さんと共に考え、安心安全なお茶づくりを目指しています。店主がお客様のリクエストにお答えしてオリジナルのブレンド茶を作っています。世界にひとつだけの味を作りませんか？,か
お茶のさすき園,427-0111,静岡県島田市阪本938-1,月～土9：00～19：00、日祝9：00～18：00,なし,,0547-38-2107,http://sasuki.jp,34.813336,138.215969,この度さすき園は、なんと店舗を全面改装いたしました！！ 店内も格段に広くなり、商品アイテムも増えております。さらにお茶屋でカフェを楽しめるスペースもできました。家族ずれのお客様にも楽しんでいただけるよう、中庭でお遊戯できる場所もあります。 お茶はどこにも負けない鮮度と品質。さすきは今までもこれからもより良くを追求し続けます。飲み茶から贈答品、配達も致します。,か
海産物処ふじ田,427-0059,静岡県島田市新田町5-24,９：００～１９：００,日曜,,0547-37-6671,http://www.kaisanbutsu-fujita.com/,34.834602,138.179024,海産物、乾物の専門店。御前崎港にあがった一本釣りの生鰹を使用した「手火山式かつお節」の取扱店です。一本釣り、生鰹、手火山式。この３つの条件がそろうかつお節は生産量が少なく全国的にみても希少です。風味、口どけをお楽しみください。ギフト商品も承ります。お気軽にお問い合わせください。,か
かざりや平林,,島田市本通6丁目7862,9:30-20:00,水曜,,0547-37-5614,http://kazariya.tv,34.832264,138.179115,宝飾品の修理、加工、リフォームの専門店。1892年創業。 アクセサリーからストラップ、数珠、直せるものは何でも直します。宝飾の職人がお客様に丁寧に説明させていただきます。当店オリジナルの商品もあります。,か
片川工務店,427-0039,静岡県島田市向谷4-1014-2,8：00～18：00,水曜日,,0547-37-3118,http://www.katakawakoumten.jp/,34.841855,138.151711,,か
株式会社カネハチ初倉店,427-0111,静岡県島田市阪本1462-1,9:00～20:00,原則無休,,0547-38-1331,,34.807751,138.218714,地域に密着したいお店です 地域を盛り上げたいお店です お客様の為になる価値あるものを提供したいお店です お客様と笑顔で触れ合いたいお店です お客様を愛したいお店です そんな心のお店です,か
Cafe &Cafe ポプリ,,島田市大津通り4－3,AM10:00～LOPM9:30,第2・第4 木曜日,,0547-36-7771,http://popuri-co.jp,34.835243,34.835243,トアルコトラジャコーヒーの飲める店として、県内からお客様が、おいでくださっています。実は ハンバーグの美味しいお店としても、根強い人気店。イラストデコレーションは全国に発送している実力店 クオリティーの高さとリーズナブルなお値段は他店を寄せ付けません！,か
クルマ買取・輸出 カースタ／（株）田中石油店,427-0107,静岡県島田市船木244-5,7:00～20:00（日曜：8:00～19:00）,なし,,0547-38-0079,http://www.facebook.com/CarexporterCARSTA/,34.804651,138.222942,出光のガソリンスタンドです！車の輸出・買取だけでなくレンタカーや中古車の販売もしています。今年から新車の個人向けリースも始めました！クルマのことならなんでもご相談に乗ります。ぜひ一度お立ち寄りくださいね！,か
桑原精肉店,427-0022,静岡県島田市本通１丁１-１７,09:00～18:00,水曜,,0547-35-3258,http://焼豚.jp,34.833256,138.172883,焼豚 ローストチキン 精肉などを真空パックにして地方発送をしております 賞味期限は一週間になっております 加工品は湯煎で温めてお食べいただけます 御注文 お待ちして居ります,か
ゴルフ室内練習場 ショットメーカー,427-0103,静岡県島田市中河996-1,6時～22時(21時受付終了),無し,,0547-38-3293,http://shotmaker.golf-hp.com/,34.801821,138.24363,雨風に関係無く練習できる室内型です。時間制打ち放題なので、スイング作りに最適です。,か
喫茶　カンサー,428-0034,静岡県島田市金谷富士見町1681-76,10:00-21:00 ラストオーダー8:30,月曜日,,0547-46-1733,http://shizuoka.j47.jp/cancer/,34.816148,138.133993,"カンサーからは焼津までを、一望できます。天気のいい日には。駿河湾がみえ、伊豆もみえます。冬には、真正面に、富士山がみえて四季折々を、楽しむことができます。富士山にちなかんだ
スイーツの、富士山パンケーキが、人気の商品となってます。是非一度お召し上がりください。",さ
花と香りの店　カモマイル,428-0017,静岡県島田市金谷栄町3465-1,9時30分?18時,日曜日（シマアツはイベント営業）,,0547-45-3752,https://www.eflora.co.jp/shop/kamomairu/,34.831427,138.127702,切り花をはじめ、園芸品やプリザーブドフラワー、フレグランスフラワーなどカモマイルのオリジナルを多種販売しています。手づくり雑貨の委託販売も人気の作家さんの素敵な物を取り揃えた楽しいお店です。各種教室も開講（フラワーアレンジ、ブーケコサージュ、フラワーセラピー＆アロマ、生け花、プリザーブド）随時生徒募集中です。シマアツでは。この日だけの楽しい！美味しい！素敵！を一杯ご用意しますので、是非遊びに来てください。レモネードスタンドチャリティーも行います。,さ
サンカク公園プロジェクト,427-0028,静岡県島田市栄町2-3,7:30?8:30,不定休,,090-6362-0683,,34.831403,138.174903,,さ
シェアキッチンTHE GROUND,,島田市栄町2-3,不定,不定,,090-6362-0683,http://sorailo.com,34.857157,138.115655,みんなで使うシェアキッチン「THE GROUND」はキッチン付きのレンタルスペースです！ ★自分の得意を活かし「1日カフェ」をオープン！ ★仲間と一緒に貸切パーティー ★キッチン付きだからできる！お料理教室 など、みなさんのアイデアで多様にご活用ください！,さ
食堂カフェ 樵 kikori,428-0004,静岡県島田市横岡579-1,11:00～17:00 （L.O.16:30）,火・水曜日と月2回の月曜日,,0547-54-5858,http://kikori-shokudou.com,34.857157,138.115655,きこりが収穫した「山の恵み」を味わえる小さな食堂カフェ。鹿・猪を使ったジビエ料理。南アルプスで穫れた自家養蜂の日本蜂蜜を使ったお菓子。田舎町にあるちょっと変わった雰囲気をお楽しみください…,さ
写真工房（有）モリサワ,428-0017,静岡県島田市金谷栄町3537,月曜から土9時から19時 日曜祝祭日9時から18時,木曜日,,0547-45-5753,http://morisawastudio.com,34.830983,138.129033,証明写真から記念撮影、写真の現像からブリント、写真の事なら何でもご相談ください。大切な家族の今をのこす家族写真の撮影はいかがでしょうか？１名様から２０名様くらいまで、当スタジオで撮影可能です。また、出張撮影も承ります。マイナンバーやパスポートなどの証明写真もすぐに仕上げます。大人の肖像撮影、LIFEPHOTOも特別価格４，９８０円（６５歳以上・税別）にて好評予約受付中です。,さ
シバモク・ショップ,427-0011,静岡県島田市東町1379,10:00～18:00,不定休,,0547-35-0612,http://www.shibamoku.com,34.835564,138.22787,木製雑貨専門店のシバモク・ショップです。小さいお店ですが、木の製品がいっぱい！出産祝い等にぴったりな木のおもちゃ！お料理や食事が楽しくなる木の食器類など木製雑貨が好きな方ならワクワクするお店です。店内の商品は限られてしまいますが、オーダー家具や木製看板の製作等、企画・デザイン・製作・取付・修理まで対応いたしますので、お気軽にご相談ください！,さ
ジャパンバザール,427-0111,静岡県島田市阪本4245-3,9:00～17:30,1月1日～5日,,0547-38-5505,,34.815846,138.208176,地元の牧場で育った美味しい牛肉、県内産の柔らかい豚肉、地元農家の方々の朝どり新鮮野菜や季節の果物が店頭に並んでいます,さ
シマダリフォーム,427-0022,静岡県島田市本通1-3-4,9:00～19:00,水曜,,0547-37-5421,https://shimada-reform.jimdo.com/,34.832892,138.172625,地元で創業35年。紳士服と婦人服の両方を修業したプロの職人が１つ１つ丁寧にお直しいたします！気やすさを重視した提案力で、お客様1人1人にあったお直しをいたします。安心安全のアフターフォローあり。洋服の事なら、当店にお任せください。,さ
島田シール製作所,427-0104,静岡県島田市井口198,8:00から17:00,土日,,0547-38-1570,http://shimadaseal.com,34.793844,138.23015,,さ
株式会社 鈴木モータース,427-0107,静岡県島田市船木249-4,８時～１７時,日曜 祝日,,0547-38-0077,http://www.carbell.jp/partner/partner_detail.php?cd=1000000639&no=0,34.804274,138.223894,鈴木モータースは創立してから60年以上、ダイハツの車を中心に、新車販売・中古車販売・点検・各種保険を扱ってきました。月々１万円（税別）のリースや、残価設定型クレジットで月々のお支払金額を抑えた買い方など、お客様のニーズに合わせた新しい買い方もお選びいただけます。,た
そね接骨院,427-0022,静岡県島田市本通1-4-7,8:00～11:30、15:00～19:00,日曜 ・祝日、水曜午後と土曜午後,,0547-54-4165,http://sonesekkotsuin.web.fc2.com,34.8327,138.172215,当院では、低周波治療器を用いたハイボルテージ療法やランダムアクセス波などを使い症状や部位に応じた治療を行います。日頃からの身体に関するお悩みから、スポーツや交通事故などでのお怪我まで承ります。一緒に完治させましょう！,た
小さな雑貨屋 ぽっけ,427-0042,静岡県島田市中央町15-9,10:00～19：00,毎週火曜日（祭日は営業日、翌日休みになります。）,,0547-54-4426,http://ameblo.jp/poche-zakka,34.837402,138.175444,大事な人や仲のいい友達へのプレゼントや頑張っている自分へのごほうびなどに選んでいただける、キッチン用品やタオル、観葉植物やガーデンアクセサリー、今流行りのアロマやファッションとアクセサリーの他、ハンドメイドの作家さん達による作品など見ているだけでも楽しい雑貨達がいっぱいです。,た
This Is Cafe 新金谷駅店,428-0013,静岡県島田市金谷東2-1112-2 新金谷駅構内,9:00-17:00(L.O.16:30),不定休(営業日はFacebookをご確認ください),,0547-46-5810,http://this-is-cafe.com/,34.826055,138.136961,This Is Cafe 新金谷駅店は、SL列車の始発駅でもある「大井川鐵道 新金谷駅」構内のコーヒースタンドです。ここではバリスタが淹れる本格コーヒーが味わえます。オーダーを受けてから一杯ごとに豆から挽き、いつでも挽き立ての味を堪能できます。This Is Cafe自慢のカフェラテを、SLとコラボさせた「SLラテ」が飲めるのは全４店舗の中でもここだけです。旅の思い出に記念撮影スポットもご用意しています。また、ホットドッグやサンドイッチなどの軽食はドリンクとの相性も抜群！ドリンク、フードすべてテイクアウト＆車内持ち込みＯＫです！ 至極の一杯を、ぜひSLと共にご堪能ください。,た
とろろ屋ととろ,428-0034,静岡県島田市金谷富士見町3172,11:00-15:00　　17:00-21:00(水曜日ランチのみ営業),木曜日,,0547-32-9637,http://tororoyatotoro.com,34.813634,138.134102,オリジナリティ溢れた自然薯料理、夜は居酒屋メニュー、島田のお酒も豊富にあります。お食事、宴会、法事、飲み会、全てに対応できます。,な
とろろ屋ととろ　初倉店,427-0111,静岡県島田市阪本938-1,11:00?15:00/17:00?22:00（水曜日は15:00まで）,木曜日,,0547-39-7088,http://tororoyatotoro.com/,34.81324,138.216187,農を食で繋ぎ笑顔をつくるお店！ご来店お待ちしております。,な
株)なるおかサイクル,,島田市大井町6-11,平日11:00～20:00 週末10:00～20:00,水曜,,0547-37-3609,http://www.naro-jp.com,34.833842,138.172718,第一回から参加させて頂いております、総合自転車店です！海外有名スポーツサイクルブランド、TREK SPECIALIZED cannondel PINARELLOを扱っております！是非、遊びに来て下さい！,な
中屋酒店,428-0005,静岡県島田市横岡新田228,営業時間 8:00?21:00 酒場 16:00?,第2第4月曜日、毎週火曜日,,0547-45-3208,http://nakayasake.eshizuoka.jp/,34.847551,138.121018,笑顔と元気をモットーに美味しい♪楽しい♪やさしい♪をお客様にお届けします♪「酒場」併設の昔ながらの酒屋です。オススメは当店オリジナル純米酒「かなや日和」 当日は「街はずれの酒場LIVE」同時開催♪（３バンド出演予定）,は
neu coffee,426-0055,静岡県藤枝市大西町3-1-7,10:00?16:00,日曜・月曜,,054-330-1539,,34.828761,138.223761,,は
ビューティスタジオ・ノエ,427-0029,静岡県島田市日之出町1-3,10：00～17：00,日曜・祝日,,0547-357888,http://ameblo.jp/beautystudio-k/,34.832064,138.174813,当店は、お客様の実現したい希望や目的に合わせて美容と健康のお手伝いをしています。お客様のキレイの実現の為に、出来ることは全て行い、実現していく事を責任持って営業しております。,は
ふじ膳,,島田市栄町2-4,11:00～14:00 17:00～0:00,月曜,,0547-37-3990,,34.831284,138.174933,島田駅から徒歩１分！創業38年。家庭的な居酒屋ふじ膳です。いつもは夜の営業ですが…シマアツ限定でランチ営業をさせて頂いてます。初めての方もランチタイムを是非覗いてみて下さい。お待ちしてまーす。,は
bloom アロマのお店,427-0028,静岡県島田市栄町2-1,10:00～19:00,水曜日,,0547-37-8210,http://aromacarebloom.web.fc2.com/,34.831289,138.174511,島田市には少ない アロマとエステのお店です。アロマ教室の生徒さんだけでなく、一般のお客様にも【アロマクラフト】として、アロマを混ぜてお作りするオリジナルの香りのアイテム各種の販売もしております。美容部門では、しっかり抜ける脱毛のほか バストケア、美顔等も行っており アロマの焚かれたお部屋でのリラックスも兼ねたケアがご好評いただいています。,は
（株）フジタ塗装,427-0107,静岡県島田市船木328-11,8時から19時,日曜,,0547-32-9972,http://www.fujitatosou.jp,34.800823,138.226228,,は
文具・事務機のオカダ,427-0022,静岡県島田市本通三丁目5-7,平日・土曜日 9:00-20:00 日曜・祝日 10:00-19:00,なし,,0547-36-2626,,34.832863,138.175972,定番や最新の文具や画材、その他セレクトした雑貨などを揃えています。2F工房では名刺や封筒印刷、チラシやDMなどのデザインも行っています。なんでもお気軽にご相談ください。,は
細島屋 花水木,427-0041,静岡県島田市中河町366-1,7:00-9:00 11:00-14:00,土曜日,,0547-35-5622,http://hosojimaya.eshizuoka.jp/,34.841671,138.176095,朝は朝そば。昼はそば・うどん、丼の豊富な品揃えと、それらを組み合わせたセットメニューをご用意。地元で50年続く蕎麦屋です。,は
Boulderingたきび,427-0056,静岡県島田市大津通14-6,平日　14:00~22:00 (1.3.5水　18:00~22:00) 土曜　10:00~22:00　日.祝　10:00~20:00,火曜.第2.4水曜,,090-1236-2693,http://r.goope.jp/boulderingtakibi/,34.833735,138.179014,,は
Honda Cars 島田西 金谷店,428-0013,静岡県島田市金谷東一丁目1300-1,9:30～19:00,月曜日,,0547-45-2324,http://www.hondacars-shimadanishi.com,34.828499,138.138959,当店は日当たり良好、とても明るく開放的なお店です。常時、展示・試乗車も多数ございます。ぜひ来て、見て、乗って、体感してみて下さい。旧車から新型車までメーカー問わず整備もお任せ下さい。キッズコーナーもご用意しております。お子様連れのお客様も安心してお越し下さいませ,は
HondaCars島田西 中溝店,427-0047,静岡県島田市中溝町1707-16,9：30～19：00,月曜日,,0547-35-3328,http://www.hondacars-shimadanishi.com/,34.841001,138.169337,,ま
ほぐしハウス konokono~ｺﾉｺﾉ~,427-0056,静岡県島田市大津通8-2,平日9:00?20:00 土日9:00?18:00,火曜日.祝日,,090-6381-5500,,34.835476,138.178853,人知れず毎日お仕事や家事を頑張っているあなたへ。お疲れになったその身体をオンリーワンの手揉み技術で優しく柔らかに癒します。,ま
マルイエ醤油川根本家,428-0104,静岡県島田市川根町家山796,am10:00~pm6:00,水曜日,,0547-53-2212,http://www.maruie-shouyu.com,34.944174,138.075721,創業43年。代々受け継がれてきた製法で、味噌醤油を製造販売しています。糀を使った調味料なども販売しています。,や
村松時計店,427-0022,静岡県島田市本通３丁目６－１,ＡＭ９：００～ＰＭ６：００,水、祝祭日,,0547-35-2653,,34.831629,138.17388,創業100年！！ビンテージ時計が大好きな店主です。一緒に大好きな時計のお話しをしましょう♪時計でお困りの方は御相談下さい。,ら
お食事処　やまざと,428-0017,静岡県島田市金谷栄町3476-1,"11:00?14:00 ,17:00?23:00",月曜日　第三火曜日（祝日変更有）,,0547-46-2430,,34.83264,138.127169,ご家族、お友達、グループなど幅広くご利用頂いています。定食、麺類、お弁当。特に好評「日替りランチ」。女性に人気、「海鮮サラダ」「天ぷら」。,ら
ラブリーホースガーデン,,静岡県島田市川根町家山1229-2,9：00-17：00,不定休なので電話でご確認ください,,0547-53-4079,http://www.lovelyhorsegarden.com/,34.935344,138.066998,,ら
ラ・ミニョン,427-0022,静岡県島田市本通6丁目7814,10:00～17：00,月曜日木曜日,,090-7867-3377,http://minyonss.jp/,34.832219,138.180322,隠れ家的な所にカフェ&レンタルスペースが有ります。六丁目の小澤タバコやの中が喫茶になっています。探してください。身体に良い飲み物をセレクトして、ご用意しております。ランチも始めました。8人用のレンタルスペース、ミーティング、会議、ワークショップとお気軽にご利用ください?,ら
龍月堂,427-0022,静岡県島田市本通6丁目7847,8:00～19:30,火曜,,0547-37-3297,http://shizuoka.j47.jp/ryugetsudo/,34.832284,138.179496,良い材料を使い、伝統を守りつつ新しいお菓子を提案しております。季節ごとにお菓子が変わって行きますので、移り変わりを楽しんで下さい。定番の味噌饅頭、生クリーム大福、大吟醸カステラもオススメです。,わ
ＲＯＳＥ ＳＨＯＰ,,島田市ばらの丘1丁目２１－１,10：00～17：00 ランチ11：30～ 16：00ラストオーダー,12月～3月の月曜日 他は無休,,0547-37-0888,,34.852228,138.175121,バラのソフトクリームを中心にランチも大人気。バラの雑貨もたくさん揃っています。休日はリゾート気分でぜひお過ごしください。,わ
和食工房 一鮮,427-0019,静岡県島田市道悦5-12-34,ランチタイム 11:00～14:00 デｲナータイム 17:00～22:00 (土曜日は23:30まで),月曜（月一回連休あり）,,0547-36-6416,http://www4.tokai.or.jp/issen/,34.835716,138.208885,和食を中心とした創作料理が楽しめるお店です。お寿司、肉料理、揚げ物、パスタ、鍋物などをご用意しています。女子に人気の「温野菜と厚切ベーコンの和風チーズフォンデュ」もありますよ。,ん
和座こまつ,427-0027,静岡県島田市幸町17-4,11:00-14:00 17:00-22:00 日祝は17:00-21:00,月曜,,0547-37-3681,http://komatsu3.com/,34.833844,138.176024,地元島田市の新鮮な野菜や駿河湾の魚介類を踏んだんに使った四季折々の料理をお楽しみ下さい。地酒や銘酒も取り揃えております。,わ
喫茶 ん,428-0011,静岡県島田市番生寺726-8,火、水、木、日10時?19時 金、土10時?23時,月曜日、第3日曜日,,0547-46-1913,,34.843756,138.12075,SLが見える昔ながらの喫茶店,わ
